{
  "$schema": "https://json-schema.org/draft/2020-12/schema",
  "$id": "https://discoveryathome.org/schema/v0/catalog.schema.json",
  "title": "Task catalogue: weighted tracks of research task cards",
  "type": "object",
  "required": ["schema", "priority_revision", "assessed_on", "tracks"],
  "properties": {
    "schema": { "const": "discover-catalog/v0" },
    "priority_revision": { "type": "integer", "minimum": 1 },
    "assessed_on": { "type": "string", "format": "date" },
    "priority_log": { "type": "string" },
    "status": { "type": "string" },
    "tracks": {
      "type": "array", "minItems": 1,
      "description": "Weights are positive integers summing to 100 (checked by `discover validate`, not expressible here).",
      "items": {
        "type": "object", "required": ["id", "weight", "tasks"],
        "properties": {
          "id": { "type": "string", "pattern": "^[a-z0-9-]+$" },
          "weight": { "type": "integer", "minimum": 1 },
          "useful_outcome": { "type": "string" },
          "tasks": { "type": "array", "items": { "$ref": "#/$defs/card" } }
        }
      }
    }
  },
  "$defs": {
    "card": {
      "type": "object",
      "required": ["id", "question", "starting_points", "methods", "acceptance_gate", "first_step", "bottleneck_link"],
      "properties": {
        "id": { "type": "string", "pattern": "^[a-z0-9-]+$" },
        "question": { "type": "string" },
        "starting_points": { "type": "array", "items": { "type": "string" } },
        "methods": { "type": "array", "items": { "type": "string" }, "minItems": 1 },
        "acceptance_gate": { "type": "string" },
        "first_step": {
          "type": "object", "required": ["command", "expected"],
          "description": "Positive control: proves the environment works before new work starts.",
          "properties": {
            "command": { "type": "array", "items": { "type": "string" } },
            "expected": { "type": "string" },
            "inspect": { "type": "string" },
            "scope": { "type": "string" }
          }
        },
        "first_experiment": { "type": "string" },
        "bottleneck_link": { "type": "string" },
        "allowed_variations": { "type": "array", "items": { "type": "string" } },
        "scope_change_triggers": { "type": "array", "items": { "type": "string" } },
        "overlap_terms": { "type": "array", "items": { "type": "string" } },
        "existing_checks": {
          "type": "array", "items": { "type": "string" },
          "description": "New in v0: what already covers this card for the current frontier."
        }
      }
    }
  }
}
